{
  "feature": "time-tracking",
  "title": "Time tracking: timers, manual entries, task time and a weekly timesheet with CSV export",
  "version": 1,
  "overview": {
    "problemStatement": "Tasks carry a story-point estimate, but nobody could see how much time the work actually took, who spent it and on which day. Without that, estimates never improve, a weekly report has to be assembled by hand, and a team cannot tell a ten-minute fix from a two-day investigation. Time had to be captured with as little friction as possible, next to the work itself, and it had to be exportable for whoever needs the figures outside the app.",
    "proposedSolution": "A TimeEntry document (server/src/models/timeEntryModel.ts) records one stretch of work on a task: whole minutes, a start, an optional end and a note, with a running flag for the caller's open timer. Minutes are logged by hand (minutes or a start and an end) or produced by a timer that is started and stopped from the task or from the header pill. The task's loggedMinutes is resynchronised from its stopped entries on every change, so the task list stays correct. GET /api/workspaces/:slug/time returns the timesheet with totals per person, day and task, and /time/export.csv writes the same rows as RFC 4180 CSV with a formula-injection guard.",
    "targetAudience": "Individual contributors who log their own time and run a timer while they work, and team leads or workspace administrators who review a week for one person or the whole team and export it.",
    "assumptions": [
      "Time is recorded in whole minutes; there is no second-level precision, and a timer that is stopped at once still counts one minute.",
      "The day a timesheet groups by is the UTC calendar day of the entry's start (dayKey slices the ISO string), while the weekly grid on the client groups by the viewer's local calendar day.",
      "The running timer is deliberately kept out of every total: a timesheet and its export only contain stopped entries, and the open timer is reported separately.",
      "A timer left running overnight keeps counting up to a single day (1440 minutes) and is then capped rather than growing without bound."
    ],
    "outOfScope": [
      "Approval workflows for timesheets, and locking a period once it has been reviewed.",
      "Billing rates, billable/non-billable flags and invoicing; the export is plain CSV.",
      "Time estimates in hours as a first-class citizen: the estimate is stored as minutes but shown parsed, and no reporting compares it across tasks.",
      "Absence, holiday or capacity calendars."
    ]
  },
  "userStories": [
    {
      "id": "US-001",
      "title": "Log time on a task by hand",
      "role": "team member",
      "want": "record the minutes I spent, with an optional start time and a note",
      "benefit": "the work I did is visible on the task even when I forgot to run a timer",
      "acceptanceCriteria": [
        {
          "id": "AC-001",
          "text": "A manual entry is created from either a number of minutes (1 to 1440) with an optional start time and note, or from a start and an end time; the entry is stored stopped and the response returns it together with the task's new loggedMinutes."
        },
        {
          "id": "AC-002",
          "text": "When a start and an end are given, the length must be at least one minute and at most 1440 minutes; otherwise the request is refused with HTTP 400 and a message stating that limit."
        },
        {
          "id": "AC-003",
          "text": "Minutes outside 1 to 1440 and a note longer than 200 characters are refused with HTTP 400 by the validation chain."
        },
        {
          "id": "AC-004",
          "text": "A start time more than one day in the future is refused with HTTP 400 'You cannot log time more than a day ahead'."
        }
      ]
    },
    {
      "id": "US-002",
      "title": "Run a timer while I work",
      "role": "team member",
      "want": "start a timer on the task I am working on and stop it when I switch",
      "benefit": "I do not have to remember how long I worked",
      "acceptanceCriteria": [
        {
          "id": "AC-005",
          "text": "Starting a timer creates a running entry (endedAt null, minutes 0) and answers with it; starting again on the same task returns the entry that is already running instead of creating a second one."
        },
        {
          "id": "AC-006",
          "text": "A user has at most one running timer per workspace: starting a timer while another one runs stops and logs the previous entry first and returns both the new entry and the stopped one."
        },
        {
          "id": "AC-007",
          "text": "Stopping the timer on a task ends it at the current time, capped at 1440 minutes after it started, and logs at least one minute."
        }
      ]
    },
    {
      "id": "US-003",
      "title": "See logged time against the estimate on a task",
      "role": "team member",
      "want": "the estimate, the logged total, my running timer and the individual entries on the task",
      "benefit": "I can tell whether the task is over or under its estimate without leaving the task",
      "acceptanceCriteria": [
        {
          "id": "AC-008",
          "text": "The task time endpoint returns the estimate in minutes (or null), the task's loggedMinutes, the caller's running entry (or null) and up to 500 entries newest first with the user who logged them."
        },
        {
          "id": "AC-009",
          "text": "Deleting an entry is allowed for its author, and for a role holding settings:manage; anyone else receives HTTP 403 'You can only delete your own time entries'. After logging, stopping or deleting, the task's loggedMinutes equals the sum of its stopped entries."
        }
      ]
    },
    {
      "id": "US-004",
      "title": "Review a week of time",
      "role": "team lead",
      "want": "a timesheet for a date range, per person or for the whole workspace, with totals",
      "benefit": "I can see where the week went and who worked on what",
      "acceptanceCriteria": [
        {
          "id": "AC-010",
          "text": "The timesheet returns the entries of the range with totals overall and per user, per day and per task; a caller without settings:manage only ever receives their own entries."
        },
        {
          "id": "AC-011",
          "text": "A project filter limits the timesheet to entries on tasks of that project, and the response says truncated when more entries exist than the page limit, returning the newest 5000."
        }
      ]
    },
    {
      "id": "US-005",
      "title": "Export a timesheet as CSV",
      "role": "team lead",
      "want": "download the same figures as a CSV file",
      "benefit": "I can hand the numbers to a spreadsheet or an invoicing process",
      "acceptanceCriteria": [
        {
          "id": "AC-012",
          "text": "The export answers as text/csv with a UTF-8 byte-order mark, one row per entry and the columns Date, User, Task key, Task, Project, Started, Ended, Minutes, Hours and Note, offered for download with the workspace slug and the day in the filename."
        },
        {
          "id": "AC-013",
          "text": "The export honours the same filters as the timesheet (from, to, user, project), accepts at most 20000 entries, and every field is quoted with inner quotes doubled; text a spreadsheet could run as a formula gets a leading apostrophe."
        }
      ]
    }
  ],
  "functionalRequirements": [
    {
      "id": "FR-001",
      "text": "server/src/models/timeEntryModel.ts stores one stretch of work: workspace, task, user, startedAt, endedAt (null while running), whole minutes (0 while running, min 0), a note of at most 200 characters and a running flag, plus the indexes { workspace, user, startedAt } and { task }. A partial unique index on { workspace, user } with partialFilterExpression { running: true } makes a second running timer impossible, even when two start requests race.",
      "linkedAcceptanceCriteria": ["AC-005", "AC-006"]
    },
    {
      "id": "FR-002",
      "text": "POST /api/workspaces/:slug/tasks/:id/time (addTimeEntry) logs by hand: either minutes (1..1440, with an optional startedAt that defaults to now minus those minutes) or startedAt together with endedAt, whose length must be 1..1440 minutes (400 otherwise). validateTimeEntry is a custom chain that requires either minutes or both timestamps, caps the note at 200 characters, and the handler refuses a start more than a day ahead. It answers 201 with { entry, loggedMinutes }.",
      "linkedAcceptanceCriteria": ["AC-001", "AC-002", "AC-003", "AC-004"]
    },
    {
      "id": "FR-003",
      "text": "POST /api/workspaces/:slug/tasks/:id/timer/start (startTimer) returns the entry already running on that task if there is one; otherwise it stops and logs any timer the caller has running elsewhere in the workspace and creates a running entry (endedAt null, minutes 0) for that task, answering 201 with { entry, stopped }.",
      "linkedAcceptanceCriteria": ["AC-005", "AC-006"]
    },
    {
      "id": "FR-004",
      "text": "POST /api/workspaces/:slug/tasks/:id/timer/stop (stopTimer) ends the caller's running timer on that task. timerEnd caps the end at start + MAX_TIMER_MINUTES (1440) and minutesBetween returns the rounded whole minutes, at least 1 and at most the cap. A stop without a running timer answers 404 'No timer is running on this task'.",
      "linkedAcceptanceCriteria": ["AC-007"]
    },
    {
      "id": "FR-005",
      "text": "syncLogged aggregates the minutes of the stopped entries of a task and writes them to the task's loggedMinutes after every log, stop and delete, returning the new total in the response. deleteTimeEntry allows the author or a holder of settings:manage (403 otherwise), and logs a time.deleted activity entry with the removed duration.",